location,question,answer
General,Do you spend a lot of time sitting or standing here?,It depends on the situation.
General,Is this place typically noisy or quiet?,"It varies, sometimes it's noisy, other times quiet."
General,How do people usually dress in this environment?,People dress differently depending on the occasion.
General,Do you often see large crowds or small groups here?,You can find both crowds and smaller groups here.
General,Is there a lot of movement or is it more stationary?,There’s a mix of movement and stationary activity.
General,Do you usually interact with strangers here?,"You might talk to strangers, or keep to yourself."
General,Is the lighting in this place bright or dim?,The lighting can change depending on the time.
General,Do people tend to stay long or leave quickly?,"Some people stay longer, others come and go quickly."
General,Is this place indoors or outdoors?,"It can be either, depending on the part of the place."
General,"Is it easy to access this place, or does it require special permission?","Some areas are open to everyone, others are restricted."
General,Do you often see people talking or staying silent here?,"Both happen, sometimes people talk, other times it's quiet."
General,Is there a lot of technology being used in this environment?,"Technology is used, but it may not be the main focus."
General,Is this place more modern or traditional?,"A bit of both, modern elements with some tradition."
General,Do people seem happy or stressed in this location?,People show a range of emotions here.
General,Is the weather something you think about when you're here?,It depends on whether you're inside or outside.
General,"Do people bring a lot of things with them, or just a few items?","Some people bring a lot, others travel light."
General,Do you hear a lot of different languages spoken here?,"Yes, it's common to hear a variety of languages."
General,Is there a lot of physical activity involved in being here?,"There can be physical activity, but not always."
General,Is this place used for work or leisure?,"It could be used for either, depending on the time."
General,Is there a particular time of day when this place is busiest?,"Yes, there's a peak time, but it's not always the same."
General,Are there rules people must follow here?,"Yes, there are usually some rules to follow."
General,Do you need to prepare before coming here?,"It's a good idea to prepare, but not always necessary."
General,Do you notice any distinct smells in this place?,"You might notice something distinctive, but it’s subtle."
General,Do people tend to stay alone or in groups?,"Some stay in groups, others are on their own."
General,"Do people use transportation to get here, or can they walk?","Both options are possible, depending on where you are."
General,Is this place associated with any particular season?,"It's connected to certain seasons, but not exclusive."
General,Do people tend to bring food or drinks here?,"Some do, but it's not required."
General,Is it common to see people using their phones here?,"Yes, you often see people using their phones."
General,Does this place have a lot of history?,"Yes, there's often a lot of history attached to it."
General,"Is this a place you visit often, or only occasionally?","It depends, some visit frequently, others only occasionally."
General,Do people dress more formally or casually here?,"Both are acceptable, depending on the situation."
General,Do you need any special equipment or clothing to be here?,"It’s possible, but it depends on what you’re doing."
General,Are there specific sounds that are common in this place?,"Yes, you can hear some distinctive sounds."
General,"Is it important to be quiet, or is it okay to talk?","You may need to be quiet, or it might not matter."
General,"Are there seats available here, or do you stand?","There are usually places to sit, but not always."
General,Is this place popular with tourists or locals?,"Both groups visit, but one may dominate at times."
General,Is this place large or small?,"It can feel large, but parts of it are small."
General,Do you need to pay to enter this place?,"It’s possible, but not always required."
General,"Do you see children here often, or mostly adults?","Both are common, depending on the day."
General,"Do people tend to stay focused, or do they relax here?","People usually stay focused, but there’s room for relaxation."
General,Do you have to plan your visit here in advance?,"Planning helps, but spontaneous visits happen too."
General,Are there a lot of signs or instructions in this environment?,"Yes, there’s usually guidance or signage."
General,Is this place very colorful or more neutral?,"It can be colorful, but sometimes it’s more muted."
General,Do people use specific tools or objects while they're here?,"Some do, but not everyone uses them."
General,Does this place have a specific purpose or is it more versatile?,"There’s a primary purpose, but it can serve others too."
General,Do people spend time here alone or with others?,"It’s common to see both, depending on the situation."
General,"Is there a lot of talking, or is it quieter here?","You hear some talking, but it’s not constant."
General,Is there a strong sense of community in this place?,"Yes, people often feel connected here."
General,"Do you feel safe here, or is it more risky?","It's generally safe, but caution is sometimes needed."
General,"Is this a place where people learn, work, or relax?","It’s a mix of learning, work, and relaxation."
Airplane,How often do you get to stand up during your time here?,"Not much, it's restricted."
Airplane,What kind of noises do you hear throughout your time here?,Mostly engine noise and announcements.
Airplane,Do you find yourself looking out of windows often?,"Yes, when possible."
Airplane,How much personal space do you have in this place?,"Very little, it's a tight space."
Airplane,Do you interact with many people in this environment?,"Yes, especially with the staff."
Bank,Do you see a lot of security measures around you?,"Yes, security is a priority here."
Bank,What are people typically holding when they come here?,They often have paperwork or items to deposit.
Bank,Do you see people standing in lines often here?,"Yes, lines are pretty common here."
Bank,Is there a lot of counting involved at this place?,"Yes, a lot of numbers being handled."
Bank,Do you handle paperwork while here?,"Yes, it’s a standard part of the process."
Beach,Do you notice people dressing very casually here?,"Yes, people tend to dress comfortably."
Beach,Is it common to see large gatherings of people here?,"Yes, gatherings and socializing are common."
Beach,How is the weather typically when you're in this place?,It's usually sunny and warm.
Beach,Do you carry a lot of things with you when you come here?,"I bring a few essentials, nothing too heavy."
Beach,What kind of footwear is common here?,Mostly sandals or bare feet.
Broadway Theater,Do you see performers working when you're here?,"Yes, performers are a key part of this environment."
Broadway Theater,Are you typically sitting down when you're in this place?,"Yes, most of the time you're seated."
Broadway Theater,Do you see a lot of people watching something at the same time?,"Yes, it's a shared experience."
Broadway Theater,Is there a lot of clapping or applause in this environment?,"Yes, clapping is frequent after performances."
Broadway Theater,Do you spend most of your time here in the dark?,"Yes, the environment is typically dim during performances."
Casino,Is this place usually noisy or quiet?,It's usually quite noisy.
Casino,Are there a lot of flashing lights where you are?,"Yes, lights and sounds are everywhere."
Casino,Do people spend a lot of money in this environment?,"Yes, people spend money constantly here."
Casino,Do people tend to come here for entertainment?,"Yes, it's a popular place for entertainment."
Casino,Do you see people taking risks when you're here?,"Yes, many people gamble or make bets."
Cathedral,Do people tend to speak softly in this place?,"Yes, people are generally quiet here."
Cathedral,Is it common to see people sitting for long periods here?,"Yes, sitting for extended periods is common."
Cathedral,Is this place very decorative or plain?,It’s often very ornate and grand.
Cathedral,Do people often look upwards in this environment?,"Yes, people often look upwards towards the ceiling."
Cathedral,Do you hear music often in this setting?,"Yes, music is a common part of the experience."
Circus Tent,Is the environment here more for entertainment or work?,"It’s mostly for entertainment, but people do work here too."
Circus Tent,Do you see a lot of movement in this place?,"Yes, there’s a lot of activity and movement."
Circus Tent,What kind of noises are common in this environment?,"Loud noises like cheering, music, and sometimes animals."
Circus Tent,Is the attire here formal or casual?,The attire is more casual or theatrical.
Circus Tent,Do people tend to come here alone or with others?,People usually come in groups or with family.
Corporate Party,Do people come here to relax or network?,"It's a mix, some are here to relax while others network."
Corporate Party,Is there a lot of small talk in this environment?,"Yes, small talk is quite common in this setting."
Corporate Party,What kind of refreshments are typically available?,"Usually light refreshments, appetizers, and drinks."
Corporate Party,Is the lighting here bright or more dim?,"It’s more dim, giving it a relaxed or social atmosphere."
Corporate Party,Do people know each other before coming here?,"Some people do, but not everyone knows each other."
Crusader Army,Is there a sense of urgency in this place?,"Yes, there's a strong sense of urgency here."
Crusader Army,Do you see a lot of physical activity happening here?,"Yes, physical activity is constant in this environment."
Crusader Army,Is the attire functional or decorative?,"It's mostly functional, but there are some decorative elements."
Crusader Army,Is this place associated with a specific historical period?,"Yes, this place is tied to a specific period in history."
Crusader Army,Do people work together or individually here?,"People work closely together, often in teams."
Day Spa,Is this a place people come to feel better physically or mentally?,"Both, people come to feel better mentally and physically."
Day Spa,Are there a lot of special tools or equipment used here?,"Yes, special tools are an essential part of the experience."
Day Spa,Is the atmosphere here calm or hectic?,It’s usually very calm and relaxing.
Day Spa,Do people come here for a short or long visit?,People typically come for a longer stay to fully enjoy it.
Day Spa,Is there a specific scent or fragrance you associate with this place?,"Yes, there’s often a relaxing fragrance in the air."
Embassy,Is this place associated with international relations?,"Yes, it deals with matters between countries."
Embassy,Are there security measures in place here?,"Yes, security is a key part of this environment."
Embassy,Do people need appointments to come here?,"Yes, most visitors need appointments or clearance."
Embassy,Is the setting formal or casual?,The environment is quite formal.
Embassy,Are there official documents involved in this environment?,"Yes, official documents are commonly dealt with here."
Hospital,Is the atmosphere here more urgent or relaxed?,"The atmosphere is often urgent, but some areas are calmer."
Hospital,Do people wear uniforms in this place?,"Yes, uniforms are standard here."
Hospital,Is it common to see a lot of technology in use here?,"Yes, technology is heavily used throughout the space."
Hospital,Is this place primarily focused on helping people?,"Yes, helping people is the primary focus here."
Hospital,Do people stay here long or do they leave quickly?,"Some stay for a while, but others leave after quick visits."
Hotel,Is this a place people come to for short stays or extended periods?,"It depends, some stay for short periods while others stay longer."
Hotel,Is the service here formal or casual?,"Service is typically formal, but it can be friendly."
Hotel,Do you see a lot of people with luggage here?,"Yes, luggage is common as people are often traveling."
Hotel,Is this place associated with travel?,"Yes, hotels are strongly associated with travel."
Hotel,Do people spend most of their time here inside or outside?,Most people spend their time indoors in this environment.
Police Station,Is the atmosphere here tense or relaxed?,"It's often tense, but it depends on the situation."
Police Station,Do people come here by choice or necessity?,"Mostly out of necessity, but sometimes by choice."
Police Station,Is there a lot of paperwork involved here?,"Yes, paperwork is a major part of what happens here."
Police Station,Do you see people in uniforms frequently?,"Yes, uniforms are common in this place."
Police Station,Is this place associated with enforcing rules?,"Yes, enforcing rules is a key function here."
Restaurant,Do people come here to relax or for something else?,Most come to relax and enjoy a meal.
Restaurant,Is there a lot of talking in this environment?,"Yes, conversations are frequent here."
Restaurant,What kind of attire is common here?,"Attire ranges from casual to formal, depending on the place."
Restaurant,Do people spend a lot of time here or just a little?,"It depends, but most don't stay too long."
Restaurant,Do you interact with the staff often here?,"Yes, interacting with staff is common."
School,Is this place usually quiet or noisy?,"It's usually noisy, but some areas are quieter."
School,Do you often see people of different ages here?,"Yes, you see people of all ages, mostly younger."
School,Is this a place for learning or for something else?,It’s mostly for learning.
School,Is there a schedule people follow here?,"Yes, a strict schedule is followed."
School,Do people bring their own materials or use what's provided?,"People bring their own materials, but some are provided."
Service Station,Is this a place people visit often or only when needed?,People come when they need something specific.
Service Station,Is there a lot of equipment or tools here?,"Yes, tools and equipment are essential here."
Service Station,Do people stay here long or is it a quick stop?,"It's usually a quick stop, not a long stay."
Service Station,Do people work with their hands in this environment?,"Yes, it's very hands-on work here."
Service Station,"Is this place indoors, outdoors, or a mix of both?","It’s a mix, partly indoors and partly outdoors."
Space Station,Is it easy to move around in this environment?,"It’s not easy, movement can be challenging."
Space Station,Is there a lot of technology being used here?,"Yes, advanced technology is used constantly."
Space Station,Is this place associated with scientific research?,"Yes, research is a major focus here."
Space Station,Do you interact with the same people frequently here?,"Yes, you interact with the same group for long periods."
Space Station,Is it common to spend a lot of time looking outside?,"Yes, looking outside is a unique part of being here."
Submarine,Is the space here confined or open?,The space is very confined and tight.
Submarine,Do you interact with a lot of people or a few?,You interact with only a small group of people.
Submarine,Is the environment here related to travel or exploration?,It’s more about exploration and operations.
Submarine,Is it noisy or quiet in this environment?,"It can be noisy, but sometimes it’s quieter."
Submarine,Do people stay in this place for a long period or short?,People stay here for extended periods of time.
Supermarket,Do people come here regularly or just occasionally?,Many people come here regularly for supplies.
Supermarket,Is it common to see a lot of movement here?,"Yes, it’s usually very busy with a lot of movement."
Supermarket,Do you interact with a lot of different people here?,"Yes, you encounter a variety of people here."
Supermarket,Is there a lot of organization in this environment?,"Yes, organization is key in this environment."
Supermarket,Do people bring things with them or leave with things?,People usually leave with what they need.
University,Is this place for studying or something else?,It’s mainly for studying and education.
University,Do you see people of different ages in this environment?,"Yes, you see people of all ages, especially students."
University,Is there a lot of talking or is it more quiet?,There’s usually a lot of talking and activity.
University,Do people stay in one place or move around a lot here?,People are constantly moving from place to place.
University,Is the atmosphere here relaxed or more serious?,"It’s a mix, but can be more serious during certain times."